titulo;num_episodio;nom_diretor;nom_produtor;data_release;qtd_personagens;qtd_planetas;qtd_naves;qtd_veiculos;qtd_especies
A New Hope;4;George Lucas;Gary Kurtz, Rick McCallum;1977-05-25;18;3;8;4;5
The Empire Strikes Back;5;Irvin Kershner;Gary Kurtz, Rick McCallum;1980-05-17;16;4;9;6;5
Return of the Jedi;6;Richard Marquand;Howard G. Kazanjian, George Lucas, Rick McCallum;1983-05-25;20;5;12;8;9
The Phantom Menace;1;George Lucas;Rick McCallum;1999-05-19;34;3;5;7;20
Attack of the Clones;2;George Lucas;Rick McCallum;2002-05-16;40;5;9;11;14
Revenge of the Sith;3;George Lucas;Rick McCallum;2005-05-19;34;13;12;13;20
